"title","author","journal","number","cites","year","cid","pubid"
"A Student's Guide to Bayesian Statistics","B Lambert","Sage Publications Ltd. London","",218,2018,"16984598066043047521","IjCSPb-OGe4C"
"The potential public health consequences of COVID-19 on malaria in Africa","E Sherrard-Smith, AB Hogan, A Hamlet, OJ Watson, C Whittaker, ...","Nature medicine","26 (9), 1411-1416",139,2020,"7992830518840875442,7243690302904645635","-f6ydRqryjwC"
"What does the COVID-19 pandemic mean for HIV, tuberculosis, and malaria control?","F Amimo, B Lambert, A Magit","Tropical medicine and health","48 (1), 1-4",108,2020,"7826530816688378547","4DMP91E08xMC"
"Epidemiological and ecological determinants of Zika virus transmission in an urban setting","J Lourenço, MM de Lima, NR Faria, A Walker, MUG Kraemer, ...","Elife","6",83,2017,"11944617064798304829","2osOgNQ5qMEC"
"Bayesian inference of agent-based models: a tool for studying kidney branching morphogenesis","B Lambert, AL MacLean, AG Fletcher, AN Combes, MH Little, HM Byrne","Journal of mathematical biology","76 (7), 1673-1697",45,2018,"13536533562108450741","qjMakFHDy7sC"
"Monitoring the age of mosquito populations using near-infrared spectroscopy","B Lambert, MT Sikulu-Lord, VS Mayagaya, G Devine, F Dowell, ...","Scientific reports","8 (1), 1-9",45,2018,"1398248350183701886","u-x6o8ySG0sC"
"Probabilistic inference on noisy time series (PINTS)","M Clerx, M Robinson, B Lambert, CL Lei, S Ghosh, GR Mirams, ...","arXiv preprint arXiv:",":1812.07388",30,2018,"17453422562488409385","hqOjcs7Dif8C"
"Movement reveals reproductive tactics in male elephants","LA Taylor, F Vollrath, B Lambert, D Lunn, I Douglas‐Hamilton, ...","Journal of Animal Ecology","89 (1), 57-67",27,2020,"16143328675511206653","MXK_kJrjxJIC"
"Birds invest wingbeats to keep a steady head and reap the ultimate benefits of flying together","LA Taylor, GK Taylor, B Lambert, JA Walker, D Biro, SJ Portugal","PLoS biology","17 (6), e3000299",26,2019,"3687495290997938784,10284643958128844085","3fE2CSJIrl8C"
"Plasmodium falciparum resistance to sulfadoxine-pyrimethamine in Africa: a systematic analysis of national trends","F Amimo, B Lambert, A Magit, J Sacarlal, M Hashizume, K Shibuya","BMJ global health","5 (11), e003217",24,2020,"13478802460375042017","R3hNpaxXUhUC"
"The pace of modern culture","B Lambert, G Kontonatsios, M Mauch, T Kokkoris, M Jockers, ...","Nature Human Behaviour","4 (4), 352-360",24,2020,"14068337981691611342","Zph67rFs4hoC"
"Neutral syndrome","AM Leroi, B Lambert, J Rosindell, X Zhang, GD Kokkoris","Nature human behaviour","4 (8), 780-790",21,2020,"3792485849235570178","aqlVkmm33-oC"
"The use of driving endonuclease genes to suppress mosquito vectors of malaria in temporally variable environments","B Lambert, A North, A Burt, HCJ Godfray","Malaria journal","17 (1), 1-14",21,2018,"18035449431306822776","UeHWp8X0CEIC"
"Systematic review of the entomological impact of insecticide-treated nets evaluated using experimental hut trials in Africa","RK Nash, B Lambert, R NʼGuessan, C Ngufor, M Rowland, R Oxborough, ...","Current research in parasitology & vector-borne diseases","1, 100047",15,2021,"6819387533168951936","bEWYMUwI8FkC"
"Endemic and epidemic human alphavirus infections in eastern Panama: An analysis of population-based cross-sectional surveys","JP Carrera, ZM Cucunubá, K Neira, B Lambert, Y Pittí, J Liscano, ...","The American journal of tropical medicine and hygiene","103 (6), 2429",15,2020,"15239144159974240452","KlAtU1dfN6UC"
"A review of prospective pathways and impacts of COVID-19 on the accessibility, safety, quality, and affordability of essential medicines and vaccines for universal health …","F Amimo, B Lambert, A Magit, M Hashizume","Globalization and health","17 (1), 1-15",14,2021,"5340153401644755966","iH-uZ7U-co4C"
"Exploring movement decisions: Can Bayesian movement‐state models explain crop consumption behaviour in elephants (Loxodonta africana)?","SM Vogel, B Lambert, AC Songhurst, GP McCulloch, AL Stronza, ...","Journal of Animal Ecology","89 (4), 1055-1068",14,2020,"3162129542351890576","YOwf2qJgpHMC"
"Context-specific emergence and growth of the SARS-CoV-2 Delta variant","JT McCrone, V Hill, S Bajaj, RE Pena, BC Lambert, R Inward, S Bhatt, ...","Nature","610 (7930), 154-160",13,2022,"12435766084223148416,6443329307624928916","J_g5lzvAfSwC"
"What does the COVID-19 pandemic mean for HIV, tuberculosis, and malaria control? Trop Med Health. 2020; 48: 32","F Amimo, B Lambert, A Magit","","",13,NA,"5003931826637390615","r0BpntZqJG4C"
"Estimating the extrinsic incubation period of malaria using a mechanistic model of sporogony","IJ Stopard, TS Churcher, B Lambert","PLoS computational biology","17 (2), e1008658",10,2021,"5149125304854441626","hFOr9nPyWt4C"
"Review and meta-analysis of the evidence for choosing between specific pyrethroids for programmatic purposes","N Lissenden, MD Kont, J Essandoh, HM Ismail, TS Churcher, B Lambert, ...","Insects","12 (9), 826",9,2021,"5496717770666301984","JV2RwH3_ST0C"
"Heterogeneity in the onwards transmission risk between local and imported cases affects practical estimates of the time-dependent reproduction number","R Creswell, D Augustin, I Bouros, HJ Farm, S Miao, A Ahern, M Robinson, ...","Philosophical Transactions of the Royal Society A","380 (2233), 20210308",7,2022,"4406525749069639830","HoB7MX3m0LUC"
"A dynamic Bayesian model for identifying high-mortality risk in hospitalized COVID-19 patients","A Momeni-Boroujeni, R Mendoza, IJ Stopard, B Lambert, A Zuretti","Infectious disease reports","13 (1), 239-250",7,2021,"14076369863050383199","4JMBOYKVnBMC"
"On revolutions","AM Leroi, B Lambert, M Mauch, M Papadopoulou, S Ananiadou, ...","Palgrave Communications","6 (1), 1-11",7,2020,"6023655679579834322","d1gkVwhDpl0C"
"Functional data analysis techniques to improve the generalizability of near-infrared spectral data for monitoring mosquito populations","PM Esperança, DF Da, B Lambert, RK Dabiré, TS Churcher","bioRxiv","",6,2020,"4079660297218475160","M3ejUd6NZC8C"
"R∗: A robust MCMC convergence diagnostic with uncertainty using decision tree classifiers","B Lambert, A Vehtari","Bayesian Analysis","17 (2), 353-379",5,2022,"8256056172054141384","_Qo2XoVZTnwC"
"The potential impact of the COVID-19 pandemic on HIV, tuberculosis, and malaria control in Africa: a systematic review of modelling studies and population surveys","F Amimo, B Lambert, A Magit, M Hashizume","","",5,2020,"12004316005460458489","mB3voiENLucC"
"Model evidence with fast tree based quadrature","T Foster, CL Lei, M Robinson, D Gavaghan, B Lambert","arXiv preprint arXiv:",":2005.11300",5,2020,"2612252036941875857","mVmsd5A6BfQC"
"A Monte Carlo method to estimate cell population heterogeneity","B Lambert, DJ Gavaghan, S Tavener","bioRxiv","758284",5,2019,"285792829179463184,12872846560738609050","kNdYIx-mwKoC"
"HIV-1 p24Gag adaptation to modern and archaic HLA-allele frequency differences in ethnic groups contributes to viral subtype diversification","NC Kist, B Lambert, S Campbell, A Katzourakis, D Lunn, P Lemey, ...","Virus evolution","6 (2), veaa085",4,2020,"2443007115765028552","HDshCWvjkbEC"
"Health inequities and clustering of fever, acute respiratory infection, diarrhoea and wasting in children under five in low-and middle-income countries: a Demographic and …","P Winskill, AB Hogan, J Thwing, L Mwandigha, PGT Walker, B Lambert","BMC medicine","19 (1), 1-11",3,2021,"14567010378043577567","k_IJM867U9cC"
"Inverse sensitivity analysis of mathematical models avoiding the curse of dimensionality","B Lambert, DJ Gavaghan, S Tavener","BioRxiv","432393",3,2018,"790034915153664965","Tyk-4Ss8FVUC"
"Risk of Plasmodium falciparum infection in south-west Burkina Faso: potential impact of expanding eligibility for seasonal malaria chemoprevention","JB Yaro, AB Tiono, A Ouedraogo, B Lambert, ZA Ouedraogo, A Diarra, ...","Scientific Reports","12 (1), 1-11",2,2022,"2215833303397438634","hMod-77fHWUC"
"Using flexible noise models to avoid noise model misspecification in inference of differential equation time series models","R Creswell, B Lambert, CL Lei, M Robinson, D Gavaghan","arXiv preprint arXiv:",":2011.04854",2,2020,"4631648244452166517","TQgYirikUcIC"
"Trends in comparative efficacy and safety of malaria control interventions for maternal and child health outcomes in Africa: a study protocol for a Bayesian network meta …","F Amimo, TD Moon, A Magit, J Sacarlal, B Lambert, S Nomura","BMJ open","9 (2), e024313",2,2019,"15439269531327774902","5nxA0vEk-isC"
"Learning transmission dynamics modelling of COVID-19 using comomodels","SA van der Vegt, L Dai, I Bouros, HJ Farm, R Creswell, O Dimdore-Miles, ...","Mathematical biosciences","108824",1,2022,"4989806215243310401","M05iB0D1s5AC"
"Changes in transmission of Enterovirus D68 (EV-D68) in England inferred from seroprevalence data","M Pons-Salort, B Lambert, E Kamau, R Pebody, H Harvala, P Simmonds, ...","medRxiv","",1,2021,"10939939634999200247","ns9cj8rnVeAC"
"Reviewing the evidence for and against selection of specific pyrethroids for programmatic purposes","N Lissenden, T Churcher, P Hancock, HM Ismail, M Kont, B Lambert, ...","","",1,2020,"9378646506898608323","j3f4tGmQtD8C"
"A Bayesian nonparametric method for detecting rapid changes in disease transmission","R Creswell, M Robinson, D Gavaghan, KV Parag, CL Lei, B Lambert","Journal of Theoretical Biology","558, 111351",0,2023,NA,"u_35RYKgDlwC"
"Epidemiological Agent-Based Modelling Software (Epiabm)","K Gallagher, I Bouros, N Fan, E Hayman, L Heirene, P Lamirande, ...","arXiv preprint arXiv:",":2212.04937",0,2022,NA,"D03iK_w7-QYC"
"Autocorrelated measurement processes and inference for ordinary differential equation models of biological systems","B Lambert, CL Lei, M Robinson, M Clerx, R Creswell, S Ghosh, S Tavener, ...","arXiv preprint arXiv:",":2210.01592",0,2022,NA,"dfsIfKJdRG4C"
"A new WHO bottle bioassay method to assess the susceptibility of mosquito vectors to public health insecticides: results from a WHO-coordinated multi-centre study","V Corbel, MD Kont, ML Ahumada, L Andréo, B Bayili, K BAYILI, B Brooke, ...","","",0,2022,NA,"4OULZ7Gr8RgC"
"Using patient biomarker time series to determine mortality risk in hospitalised COVID-19 patients: a comparative analysis across two New York hospitals","B Lambert, IJ Stopard, A Momeni-Boroujeni, R Mendoza, A Zuretti","Plos one","17 (8), e0272442",0,2022,NA,"RGFaLdJalmkC"
"The influence of selection, drift and immigration on the diversity of a tropical tree community","B Lambert, A Leroi","","",0,2022,NA,"rO6llkc54NcC"
"Movement behaviour after birth demonstrates precocial abilities of African savannah elephant, Loxodonta africana, calves","LA Taylor, G Wittemyer, B Lambert, I Douglas-Hamilton, F Vollrath","Animal Behaviour","187, 331-353",0,2022,NA,"vV6vV6tmYwMC"
"Filter inference: A scalable nonlinear mixed effects inference approach for snapshot time series data","D Augustin, B Lambert, K Wang, AC Walz, M Robinson, D Gavaghan","bioRxiv","",0,2022,NA,"a0OBvERweLwC"
"A multistage mixed-methods evaluation of the UKHSA testing response during the COVID-19 pandemic in England","R Naidoo, B Andersen-Waine, P Dahal, S Dickinson, B Lambert, M Mills, ...","medRxiv","",0,2022,NA,"yD5IFk8b50cC"
"Encoding generation time changes within reproduction numbers","KV Parag, B Cowling, BC Lambert","medRxiv","",0,2022,NA,"cFHS6HbyZ2cC"
"The influence of selection, drift and immigration on the diversity of a tropical tree community","JC Vian, B Lambert, A Leroi","bioRxiv","",0,2022,NA,"ZHo1McVdvXMC"
"A Meta-analysis of Longevity Estimates of Mosquito Vectors of Disease","B Lambert, A North, C Godfray","bioRxiv","",0,2022,NA,"pqnbT2bcN3wC"
"Treatment response prediction: Is model selection unreliable?","D Augustin, AC Walz, K Wang, B Lambert, M Clerx, M Robinson, ...","bioRxiv","",0,2022,NA,"2P1L_qKh6hAC"
"REVIEWING THE EVIDENCE FOR AND AGAINST SELECTION OF SPECIFIC PYRETHROIDS FOR PROGRAMMATIC PURPOSES","RS Lees, N Lissenden, T Churcher, P Hancock, H Ismail, M Kont, ...","AMERICAN JOURNAL OF TROPICAL MEDICINE AND HYGIENE","105 (5), 432-432",0,2021,NA,"g5m5HwL7SMYC"
"Neutral Theory is a tool that should be wielded with care","AM Leroi, B Lambert, J Rosindell, GD Kokkoris","Nature Human Behaviour","5 (7), 809-809",0,2021,NA,"M3NEmzRMIkIC"
"Supplementary materials: R convergence diagnostic","B Lambert, A Vehtari","arXiv preprint arXiv:",":2003.07900",0,2020,NA,"YFjsv_pBGBYC"
"INEQUITIES IN THE BURDEN OF FEVER, DIARRHEA AND ACUTE RESPIRATORY INFECTION IN CHILDREN UNDER FIVE IN LOW-AND MIDDLE-INCOME COUNTRIES AND THE ROLE OF INTEGRATED COMMUNITY CASE …","P Winskill, B Lambert, AB Hogan, PG Walker","AMERICAN JOURNAL OF TROPICAL MEDICINE AND HYGIENE","101, 222-223",0,2019,NA,"_kc_bZDykSQC"
"A RIGOROUS AND REPRODUCIBLE BAYESIAN METHOD FOR DETERMINATION OF THE ORIGINS OF MALARIA INFECTION IN AREAS APPROACHING ELIMINATION","B Lambert, S Bhatt, T Churcher","AMERICAN JOURNAL OF TROPICAL MEDICINE AND HYGIENE","99 (4), 357-357",0,2018,NA,"8k81kl-MbHgC"
"Understanding mosquito vectors and methods for their control","B Lambert","University of Oxford","",0,2017,NA,"9yKSN-GCB0IC"
"Current Research in Parasitology & Vector-Borne Diseases","RK Nash, B Lambert, R NʼGuessan, C Ngufor, M Rowland, R Oxborough, ...","","",0,NA,NA,"blknAaTinKkC"
